
*** Running vivado
    with args -log BIn_BCD1.vdi -applog -m64 -product Vivado -messageDb vivado.pb -mode batch -source BIn_BCD1.tcl -notrace


ECHO est  desactivado.
ECHO est  desactivado.

****** Vivado v2023.1.1 (64-bit)
  **** SW Build 3900603 on Fri Jun 16 19:31:24 MDT 2023
  **** IP Build 3900379 on Sat Jun 17 05:28:05 MDT 2023
  **** SharedData Build 3899622 on Fri Jun 16 03:34:24 MDT 2023
    ** Copyright 1986-2022 Xilinx, Inc. All Rights Reserved.
    ** Copyright 2022-2023 Advanced Micro Devices, Inc. All Rights Reserved.

source BIn_BCD1.tcl -notrace
create_project: Time (s): cpu = 00:00:11 ; elapsed = 00:00:13 . Memory (MB): peak = 483.223 ; gain = 199.570
Command: link_design -top BIn_BCD1 -part xc7a35tcpg236-1
Design is defaulting to srcset: sources_1
Design is defaulting to constrset: constrs_1
INFO: [Device 21-403] Loading part xc7a35tcpg236-1
Netlist sorting complete. Time (s): cpu = 00:00:00 ; elapsed = 00:00:00.001 . Memory (MB): peak = 888.707 ; gain = 0.000
INFO: [Project 1-479] Netlist was created with Vivado 2023.1.1
INFO: [Project 1-570] Preparing netlist for logic optimization
Parsing XDC File [C:/Repo-Asus-2026/VHDL-Basys3/Combinacionales/BinarioBCD_V1/BinarioBCD_V1.srcs/constrs_1/new/Pines.xdc]
Finished Parsing XDC File [C:/Repo-Asus-2026/VHDL-Basys3/Combinacionales/BinarioBCD_V1/BinarioBCD_V1.srcs/constrs_1/new/Pines.xdc]
INFO: [Opt 31-138] Pushed 0 inverter(s) to 0 load pin(s).
Netlist sorting complete. Time (s): cpu = 00:00:00 ; elapsed = 00:00:00 . Memory (MB): peak = 1007.324 ; gain = 0.000
INFO: [Project 1-111] Unisim Transformation Summary:
No Unisim elements were transformed.

5 Infos, 0 Warnings, 0 Critical Warnings and 0 Errors encountered.
link_design completed successfully
link_design: Time (s): cpu = 00:00:06 ; elapsed = 00:00:09 . Memory (MB): peak = 1011.324 ; gain = 523.129
Command: opt_design
Attempting to get a license for feature 'Implementation' and/or device 'xc7a35t'
INFO: [Common 17-349] Got license for feature 'Implementation' and/or device 'xc7a35t'
Running DRC as a precondition to command opt_design

Starting DRC Task
INFO: [DRC 23-27] Running DRC with 2 threads
INFO: [Project 1-461] DRC finished with 0 Errors
INFO: [Project 1-462] Please refer to the DRC report (report_drc) for more information.

Time (s): cpu = 00:00:02 ; elapsed = 00:00:01 . Memory (MB): peak = 1033.305 ; gain = 21.980

Starting Cache Timing Information Task
INFO: [Timing 38-35] Done setting XDC timing constraints.
Ending Cache Timing Information Task | Checksum: db14e8fb

Time (s): cpu = 00:00:09 ; elapsed = 00:00:09 . Memory (MB): peak = 1564.359 ; gain = 531.055

Starting Logic Optimization Task

Phase 1 Retarget
INFO: [Opt 31-138] Pushed 0 inverter(s) to 0 load pin(s).
INFO: [Opt 31-49] Retargeted 0 cell(s).
Phase 1 Retarget | Checksum: db14e8fb

Time (s): cpu = 00:00:00 ; elapsed = 00:00:00.014 . Memory (MB): peak = 1895.340 ; gain = 0.000
INFO: [Opt 31-389] Phase Retarget created 0 cells and removed 0 cells

Phase 2 Constant propagation
INFO: [Opt 31-138] Pushed 0 inverter(s) to 0 load pin(s).
Phase 2 Constant propagation | Checksum: db14e8fb

Time (s): cpu = 00:00:00 ; elapsed = 00:00:00.015 . Memory (MB): peak = 1895.340 ; gain = 0.000
INFO: [Opt 31-389] Phase Constant propagation created 0 cells and removed 0 cells

Phase 3 Sweep
Phase 3 Sweep | Checksum: db14e8fb

Time (s): cpu = 00:00:00 ; elapsed = 00:00:00.017 . Memory (MB): peak = 1895.340 ; gain = 0.000
INFO: [Opt 31-389] Phase Sweep created 0 cells and removed 0 cells

Phase 4 BUFG optimization
Phase 4 BUFG optimization | Checksum: db14e8fb

Time (s): cpu = 00:00:00 ; elapsed = 00:00:00.082 . Memory (MB): peak = 1895.340 ; gain = 0.000
INFO: [Opt 31-662] Phase BUFG optimization created 0 cells of which 0 are BUFGs and removed 0 cells.

Phase 5 Shift Register Optimization
INFO: [Opt 31-1064] SRL Remap converted 0 SRLs to 0 registers and converted 0 registers of register chains to 0 SRLs
Phase 5 Shift Register Optimization | Checksum: db14e8fb

Time (s): cpu = 00:00:00 ; elapsed = 00:00:00.089 . Memory (MB): peak = 1895.340 ; gain = 0.000
INFO: [Opt 31-389] Phase Shift Register Optimization created 0 cells and removed 0 cells

Phase 6 Post Processing Netlist
Phase 6 Post Processing Netlist | Checksum: db14e8fb

Time (s): cpu = 00:00:00 ; elapsed = 00:00:00.090 . Memory (MB): peak = 1895.340 ; gain = 0.000
INFO: [Opt 31-389] Phase Post Processing Netlist created 0 cells and removed 0 cells
Opt_design Change Summary
=========================


-------------------------------------------------------------------------------------------------------------------------
|  Phase                        |  #Cells created  |  #Cells Removed  |  #Constrained objects preventing optimizations  |
-------------------------------------------------------------------------------------------------------------------------
|  Retarget                     |               0  |               0  |                                              0  |
|  Constant propagation         |               0  |               0  |                                              0  |
|  Sweep                        |               0  |               0  |                                              0  |
|  BUFG optimization            |               0  |               0  |                                              0  |
|  Shift Register Optimization  |               0  |               0  |                                              0  |
|  Post Processing Netlist      |               0  |               0  |                                              0  |
-------------------------------------------------------------------------------------------------------------------------



Starting Connectivity Check Task

Time (s): cpu = 00:00:00 ; elapsed = 00:00:00 . Memory (MB): peak = 1895.340 ; gain = 0.000
Ending Logic Optimization Task | Checksum: db14e8fb

Time (s): cpu = 00:00:00 ; elapsed = 00:00:00.094 . Memory (MB): peak = 1895.340 ; gain = 0.000

Starting Power Optimization Task
INFO: [Pwropt 34-132] Skipping clock gating for clocks with a period < 2.00 ns.
Ending Power Optimization Task | Checksum: db14e8fb

Time (s): cpu = 00:00:00 ; elapsed = 00:00:00.013 . Memory (MB): peak = 1895.340 ; gain = 0.000

Starting Final Cleanup Task
Ending Final Cleanup Task | Checksum: db14e8fb

Time (s): cpu = 00:00:00 ; elapsed = 00:00:00 . Memory (MB): peak = 1895.340 ; gain = 0.000

Starting Netlist Obfuscation Task
Netlist sorting complete. Time (s): cpu = 00:00:00 ; elapsed = 00:00:00 . Memory (MB): peak = 1895.340 ; gain = 0.000
Ending Netlist Obfuscation Task | Checksum: db14e8fb

Time (s): cpu = 00:00:00 ; elapsed = 00:00:00.001 . Memory (MB): peak = 1895.340 ; gain = 0.000
INFO: [Common 17-83] Releasing license: Implementation
22 Infos, 0 Warnings, 0 Critical Warnings and 0 Errors encountered.
opt_design completed successfully
opt_design: Time (s): cpu = 00:00:15 ; elapsed = 00:00:16 . Memory (MB): peak = 1895.340 ; gain = 884.016
INFO: [runtcl-4] Executing : report_drc -file BIn_BCD1_drc_opted.rpt -pb BIn_BCD1_drc_opted.pb -rpx BIn_BCD1_drc_opted.rpx
Command: report_drc -file BIn_BCD1_drc_opted.rpt -pb BIn_BCD1_drc_opted.pb -rpx BIn_BCD1_drc_opted.rpx
INFO: [IP_Flow 19-234] Refreshing IP repositories
INFO: [IP_Flow 19-1704] No user IP repositories specified
INFO: [IP_Flow 19-2313] Loaded Vivado IP repository 'C:/Xilinx/Vivado/2023.1/data/ip'.
INFO: [DRC 23-27] Running DRC with 2 threads
INFO: [Vivado_Tcl 2-168] The results of DRC are in file C:/Repo-Asus-2026/VHDL-Basys3/Combinacionales/BinarioBCD_V1/BinarioBCD_V1.runs/impl_1/BIn_BCD1_drc_opted.rpt.
report_drc completed successfully
INFO: [Timing 38-480] Writing timing data to binary archive.
Writing XDEF routing.
Writing XDEF routing logical nets.
Writing XDEF routing special nets.
Write XDEF Complete: Time (s): cpu = 00:00:00 ; elapsed = 00:00:00.052 . Memory (MB): peak = 1895.340 ; gain = 0.000
INFO: [Common 17-1381] The checkpoint 'C:/Repo-Asus-2026/VHDL-Basys3/Combinacionales/BinarioBCD_V1/BinarioBCD_V1.runs/impl_1/BIn_BCD1_opt.dcp' has been generated.
Command: place_design
Attempting to get a license for feature 'Implementation' and/or device 'xc7a35t'
INFO: [Common 17-349] Got license for feature 'Implementation' and/or device 'xc7a35t'
INFO: [DRC 23-27] Running DRC with 2 threads
INFO: [Vivado_Tcl 4-198] DRC finished with 0 Errors
INFO: [Vivado_Tcl 4-199] Please refer to the DRC report (report_drc) for more information.
Running DRC as a precondition to command place_design
INFO: [DRC 23-27] Running DRC with 2 threads
INFO: [Vivado_Tcl 4-198] DRC finished with 0 Errors
INFO: [Vivado_Tcl 4-199] Please refer to the DRC report (report_drc) for more information.

Starting Placer Task
INFO: [Place 30-611] Multithreading enabled for place_design using a maximum of 2 CPUs

Phase 1 Placer Initialization

Phase 1.1 Placer Initialization Netlist Sorting
Netlist sorting complete. Time (s): cpu = 00:00:00 ; elapsed = 00:00:00 . Memory (MB): peak = 1895.340 ; gain = 0.000
Phase 1.1 Placer Initialization Netlist Sorting | Checksum: 33a2c073

Time (s): cpu = 00:00:00 ; elapsed = 00:00:00.009 . Memory (MB): peak = 1895.340 ; gain = 0.000
Netlist sorting complete. Time (s): cpu = 00:00:00 ; elapsed = 00:00:00 . Memory (MB): peak = 1895.340 ; gain = 0.000

Phase 1.2 IO Placement/ Clock Placement/ Build Placer Device
INFO: [Timing 38-35] Done setting XDC timing constraints.
Phase 1.2 IO Placement/ Clock Placement/ Build Placer Device | Checksum: 33a2c073

Time (s): cpu = 00:00:00 ; elapsed = 00:00:00.180 . Memory (MB): peak = 1895.340 ; gain = 0.000

Phase 1.3 Build Placer Netlist Model
Phase 1.3 Build Placer Netlist Model | Checksum: ed26797f

Time (s): cpu = 00:00:00 ; elapsed = 00:00:00.202 . Memory (MB): peak = 1895.340 ; gain = 0.000

Phase 1.4 Constrain Clocks/Macros
Phase 1.4 Constrain Clocks/Macros | Checksum: ed26797f

Time (s): cpu = 00:00:00 ; elapsed = 00:00:00.204 . Memory (MB): peak = 1895.340 ; gain = 0.000
Phase 1 Placer Initialization | Checksum: ed26797f

Time (s): cpu = 00:00:00 ; elapsed = 00:00:00.208 . Memory (MB): peak = 1895.340 ; gain = 0.000

Phase 2 Global Placement

Phase 2.1 Floorplanning
Phase 2.1 Floorplanning | Checksum: ed26797f

Time (s): cpu = 00:00:00 ; elapsed = 00:00:00.210 . Memory (MB): peak = 1895.340 ; gain = 0.000

Phase 2.2 Update Timing before SLR Path Opt
Phase 2.2 Update Timing before SLR Path Opt | Checksum: ed26797f

Time (s): cpu = 00:00:00 ; elapsed = 00:00:00.211 . Memory (MB): peak = 1895.340 ; gain = 0.000

Phase 2.3 Post-Processing in Floorplanning
Phase 2.3 Post-Processing in Floorplanning | Checksum: ed26797f

Time (s): cpu = 00:00:00 ; elapsed = 00:00:00.212 . Memory (MB): peak = 1895.340 ; gain = 0.000

Phase 2.4 Global Placement Core
WARNING: [Place 46-29] Timing had been disabled during Placer and, therefore, physical synthesis in Placer will be skipped.
Phase 2.4 Global Placement Core | Checksum: dc039c6a

Time (s): cpu = 00:00:01 ; elapsed = 00:00:01 . Memory (MB): peak = 1895.340 ; gain = 0.000
Phase 2 Global Placement | Checksum: dc039c6a

Time (s): cpu = 00:00:01 ; elapsed = 00:00:01 . Memory (MB): peak = 1895.340 ; gain = 0.000

Phase 3 Detail Placement

Phase 3.1 Commit Multi Column Macros
Phase 3.1 Commit Multi Column Macros | Checksum: dc039c6a

Time (s): cpu = 00:00:01 ; elapsed = 00:00:01 . Memory (MB): peak = 1895.340 ; gain = 0.000

Phase 3.2 Commit Most Macros & LUTRAMs
Phase 3.2 Commit Most Macros & LUTRAMs | Checksum: d95a1e61

Time (s): cpu = 00:00:01 ; elapsed = 00:00:01 . Memory (MB): peak = 1895.340 ; gain = 0.000

Phase 3.3 Area Swap Optimization
Phase 3.3 Area Swap Optimization | Checksum: b7f3d165

Time (s): cpu = 00:00:01 ; elapsed = 00:00:01 . Memory (MB): peak = 1895.340 ; gain = 0.000

Phase 3.4 Pipeline Register Optimization
Phase 3.4 Pipeline Register Optimization | Checksum: b7f3d165

Time (s): cpu = 00:00:01 ; elapsed = 00:00:01 . Memory (MB): peak = 1895.340 ; gain = 0.000

Phase 3.5 Small Shape Detail Placement
Phase 3.5 Small Shape Detail Placement | Checksum: 115f6f528

Time (s): cpu = 00:00:01 ; elapsed = 00:00:01 . Memory (MB): peak = 1895.340 ; gain = 0.000

Phase 3.6 Re-assign LUT pins
Phase 3.6 Re-assign LUT pins | Checksum: 115f6f528

Time (s): cpu = 00:00:01 ; elapsed = 00:00:01 . Memory (MB): peak = 1895.340 ; gain = 0.000

Phase 3.7 Pipeline Register Optimization
Phase 3.7 Pipeline Register Optimization | Checksum: 115f6f528

Time (s): cpu = 00:00:01 ; elapsed = 00:00:01 . Memory (MB): peak = 1895.340 ; gain = 0.000
Phase 3 Detail Placement | Checksum: 115f6f528

Time (s): cpu = 00:00:01 ; elapsed = 00:00:01 . Memory (MB): peak = 1895.340 ; gain = 0.000

Phase 4 Post Placement Optimization and Clean-Up

Phase 4.1 Post Commit Optimization
Phase 4.1 Post Commit Optimization | Checksum: 115f6f528

Time (s): cpu = 00:00:01 ; elapsed = 00:00:01 . Memory (MB): peak = 1895.340 ; gain = 0.000

Phase 4.2 Post Placement Cleanup
Phase 4.2 Post Placement Cleanup | Checksum: 115f6f528

Time (s): cpu = 00:00:01 ; elapsed = 00:00:01 . Memory (MB): peak = 1895.340 ; gain = 0.000

Phase 4.3 Placer Reporting

Phase 4.3.1 Print Estimated Congestion
INFO: [Place 30-612] Post-Placement Estimated Congestion 
 ____________________________________________________
|           | Global Congestion | Short Congestion  |
| Direction | Region Size       | Region Size       |
|___________|___________________|___________________|
|      North|                1x1|                1x1|
|___________|___________________|___________________|
|      South|                1x1|                1x1|
|___________|___________________|___________________|
|       East|                1x1|                1x1|
|___________|___________________|___________________|
|       West|                1x1|                1x1|
|___________|___________________|___________________|

Phase 4.3.1 Print Estimated Congestion | Checksum: 115f6f528

Time (s): cpu = 00:00:01 ; elapsed = 00:00:01 . Memory (MB): peak = 1895.340 ; gain = 0.000
Phase 4.3 Placer Reporting | Checksum: 115f6f528

Time (s): cpu = 00:00:01 ; elapsed = 00:00:01 . Memory (MB): peak = 1895.340 ; gain = 0.000

Phase 4.4 Final Placement Cleanup
Netlist sorting complete. Time (s): cpu = 00:00:00 ; elapsed = 00:00:00.001 . Memory (MB): peak = 1895.340 ; gain = 0.000

Time (s): cpu = 00:00:01 ; elapsed = 00:00:01 . Memory (MB): peak = 1895.340 ; gain = 0.000
Phase 4 Post Placement Optimization and Clean-Up | Checksum: 115f6f528

Time (s): cpu = 00:00:01 ; elapsed = 00:00:01 . Memory (MB): peak = 1895.340 ; gain = 0.000
Ending Placer Task | Checksum: fa0b5aad

Time (s): cpu = 00:00:01 ; elapsed = 00:00:01 . Memory (MB): peak = 1895.340 ; gain = 0.000
INFO: [Common 17-83] Releasing license: Implementation
41 Infos, 1 Warnings, 0 Critical Warnings and 0 Errors encountered.
place_design completed successfully
INFO: [runtcl-4] Executing : report_io -file BIn_BCD1_io_placed.rpt
report_io: Time (s): cpu = 00:00:00 ; elapsed = 00:00:00.067 . Memory (MB): peak = 1895.340 ; gain = 0.000
INFO: [runtcl-4] Executing : report_utilization -file BIn_BCD1_utilization_placed.rpt -pb BIn_BCD1_utilization_placed.pb
INFO: [runtcl-4] Executing : report_control_sets -verbose -file BIn_BCD1_control_sets_placed.rpt
report_control_sets: Time (s): cpu = 00:00:00 ; elapsed = 00:00:00.003 . Memory (MB): peak = 1895.340 ; gain = 0.000
INFO: [Timing 38-480] Writing timing data to binary archive.
Writing XDEF routing.
Writing XDEF routing logical nets.
Writing XDEF routing special nets.
Write XDEF Complete: Time (s): cpu = 00:00:00 ; elapsed = 00:00:00.048 . Memory (MB): peak = 1895.340 ; gain = 0.000
INFO: [Common 17-1381] The checkpoint 'C:/Repo-Asus-2026/VHDL-Basys3/Combinacionales/BinarioBCD_V1/BinarioBCD_V1.runs/impl_1/BIn_BCD1_placed.dcp' has been generated.
Command: phys_opt_design
Attempting to get a license for feature 'Implementation' and/or device 'xc7a35t'
INFO: [Common 17-349] Got license for feature 'Implementation' and/or device 'xc7a35t'

Starting Initial Update Timing Task

Time (s): cpu = 00:00:00 ; elapsed = 00:00:00.014 . Memory (MB): peak = 1895.340 ; gain = 0.000
INFO: [Vivado_Tcl 4-235] No timing constraint found. The netlist was not modified.
INFO: [Common 17-83] Releasing license: Implementation
49 Infos, 1 Warnings, 0 Critical Warnings and 0 Errors encountered.
phys_opt_design completed successfully
INFO: [Timing 38-480] Writing timing data to binary archive.
Writing XDEF routing.
Writing XDEF routing logical nets.
Writing XDEF routing special nets.
Write XDEF Complete: Time (s): cpu = 00:00:00 ; elapsed = 00:00:00.053 . Memory (MB): peak = 1905.562 ; gain = 10.223
INFO: [Common 17-1381] The checkpoint 'C:/Repo-Asus-2026/VHDL-Basys3/Combinacionales/BinarioBCD_V1/BinarioBCD_V1.runs/impl_1/BIn_BCD1_physopt.dcp' has been generated.
Command: route_design
Attempting to get a license for feature 'Implementation' and/or device 'xc7a35t'
INFO: [Common 17-349] Got license for feature 'Implementation' and/or device 'xc7a35t'
Running DRC as a precondition to command route_design
INFO: [DRC 23-27] Running DRC with 2 threads
INFO: [Vivado_Tcl 4-198] DRC finished with 0 Errors
INFO: [Vivado_Tcl 4-199] Please refer to the DRC report (report_drc) for more information.


Starting Routing Task
INFO: [Route 35-254] Multithreading enabled for route_design using a maximum of 2 CPUs

Phase 1 Build RT Design
Checksum: PlaceDB: e7794d2a ConstDB: 0 ShapeSum: 12920d83 RouteDB: 0
Post Restoration Checksum: NetGraph: e73ae80f | NumContArr: 11b8f240 | Constraints: 190a55ad | Timing: 0
Phase 1 Build RT Design | Checksum: 111fe2ffc

Time (s): cpu = 00:00:37 ; elapsed = 00:00:35 . Memory (MB): peak = 1991.203 ; gain = 73.527

Phase 2 Router Initialization
INFO: [Route 35-64] No timing constraints were detected. The router will operate in resource-optimization mode.

Phase 2.1 Fix Topology Constraints
Phase 2.1 Fix Topology Constraints | Checksum: 111fe2ffc

Time (s): cpu = 00:00:37 ; elapsed = 00:00:35 . Memory (MB): peak = 1997.242 ; gain = 79.566

Phase 2.2 Pre Route Cleanup
Phase 2.2 Pre Route Cleanup | Checksum: 111fe2ffc

Time (s): cpu = 00:00:37 ; elapsed = 00:00:35 . Memory (MB): peak = 1997.242 ; gain = 79.566
 Number of Nodes with overlaps = 0

Router Utilization Summary
  Global Vertical Routing Utilization    = 0 %
  Global Horizontal Routing Utilization  = 0 %
  Routable Net Status*
  *Does not include unroutable nets such as driverless and loadless.
  Run report_route_status for detailed report.
  Number of Failed Nets               = 20
    (Failed Nets is the sum of unrouted and partially routed nets)
  Number of Unrouted Nets             = 20
  Number of Partially Routed Nets     = 0
  Number of Node Overlaps             = 0

Phase 2 Router Initialization | Checksum: 1a01b56e4

Time (s): cpu = 00:00:38 ; elapsed = 00:00:36 . Memory (MB): peak = 2001.840 ; gain = 84.164

Phase 3 Initial Routing

Phase 3.1 Global Routing
Phase 3.1 Global Routing | Checksum: 1a01b56e4

Time (s): cpu = 00:00:38 ; elapsed = 00:00:36 . Memory (MB): peak = 2001.840 ; gain = 84.164
Phase 3 Initial Routing | Checksum: 391307d4

Time (s): cpu = 00:00:38 ; elapsed = 00:00:36 . Memory (MB): peak = 2001.840 ; gain = 84.164

Phase 4 Rip-up And Reroute

Phase 4.1 Global Iteration 0
 Number of Nodes with overlaps = 1
 Number of Nodes with overlaps = 0
Phase 4.1 Global Iteration 0 | Checksum: 9552fd1c

Time (s): cpu = 00:00:38 ; elapsed = 00:00:36 . Memory (MB): peak = 2001.840 ; gain = 84.164
Phase 4 Rip-up And Reroute | Checksum: 9552fd1c

Time (s): cpu = 00:00:38 ; elapsed = 00:00:36 . Memory (MB): peak = 2001.840 ; gain = 84.164

Phase 5 Delay and Skew Optimization
Phase 5 Delay and Skew Optimization | Checksum: 9552fd1c

Time (s): cpu = 00:00:38 ; elapsed = 00:00:36 . Memory (MB): peak = 2001.840 ; gain = 84.164

Phase 6 Post Hold Fix

Phase 6.1 Hold Fix Iter
Phase 6.1 Hold Fix Iter | Checksum: 9552fd1c

Time (s): cpu = 00:00:38 ; elapsed = 00:00:36 . Memory (MB): peak = 2001.840 ; gain = 84.164
Phase 6 Post Hold Fix | Checksum: 9552fd1c

Time (s): cpu = 00:00:38 ; elapsed = 00:00:36 . Memory (MB): peak = 2001.840 ; gain = 84.164

Phase 7 Route finalize

Router Utilization Summary
  Global Vertical Routing Utilization    = 0.0129953 %
  Global Horizontal Routing Utilization  = 0.013925 %
  Routable Net Status*
  *Does not include unroutable nets such as driverless and loadless.
  Run report_route_status for detailed report.
  Number of Failed Nets               = 0
    (Failed Nets is the sum of unrouted and partially routed nets)
  Number of Unrouted Nets             = 0
  Number of Partially Routed Nets     = 0
  Number of Node Overlaps             = 0


--GLOBAL Congestion:
Utilization threshold used for congestion level computation: 0.85
Congestion Report
North Dir 1x1 Area, Max Cong = 12.6126%, No Congested Regions.
South Dir 1x1 Area, Max Cong = 14.4144%, No Congested Regions.
East Dir 1x1 Area, Max Cong = 11.7647%, No Congested Regions.
West Dir 1x1 Area, Max Cong = 5.88235%, No Congested Regions.

------------------------------
Reporting congestion hotspots
------------------------------
Direction: North
----------------
Congested clusters found at Level 0
Effective congestion level: 0 Aspect Ratio: 1 Sparse Ratio: 0
Direction: South
----------------
Congested clusters found at Level 0
Effective congestion level: 0 Aspect Ratio: 1 Sparse Ratio: 0
Direction: East
----------------
Congested clusters found at Level 0
Effective congestion level: 0 Aspect Ratio: 1 Sparse Ratio: 0
Direction: West
----------------
Congested clusters found at Level 0
Effective congestion level: 0 Aspect Ratio: 1 Sparse Ratio: 0

Phase 7 Route finalize | Checksum: 9552fd1c

Time (s): cpu = 00:00:38 ; elapsed = 00:00:36 . Memory (MB): peak = 2001.840 ; gain = 84.164

Phase 8 Verifying routed nets

 Verification completed successfully
Phase 8 Verifying routed nets | Checksum: 9552fd1c

Time (s): cpu = 00:00:38 ; elapsed = 00:00:36 . Memory (MB): peak = 2002.516 ; gain = 84.840

Phase 9 Depositing Routes
Phase 9 Depositing Routes | Checksum: b41d05f2

Time (s): cpu = 00:00:38 ; elapsed = 00:00:36 . Memory (MB): peak = 2002.516 ; gain = 84.840
INFO: [Route 35-16] Router Completed Successfully

Phase 10 Post-Route Event Processing
Phase 10 Post-Route Event Processing | Checksum: 1db08dc9

Time (s): cpu = 00:00:38 ; elapsed = 00:00:36 . Memory (MB): peak = 2002.516 ; gain = 84.840

Time (s): cpu = 00:00:38 ; elapsed = 00:00:36 . Memory (MB): peak = 2002.516 ; gain = 84.840

Routing Is Done.
INFO: [Common 17-83] Releasing license: Implementation
59 Infos, 1 Warnings, 0 Critical Warnings and 0 Errors encountered.
route_design completed successfully
route_design: Time (s): cpu = 00:00:40 ; elapsed = 00:00:37 . Memory (MB): peak = 2002.516 ; gain = 96.953
INFO: [runtcl-4] Executing : report_drc -file BIn_BCD1_drc_routed.rpt -pb BIn_BCD1_drc_routed.pb -rpx BIn_BCD1_drc_routed.rpx
Command: report_drc -file BIn_BCD1_drc_routed.rpt -pb BIn_BCD1_drc_routed.pb -rpx BIn_BCD1_drc_routed.rpx
INFO: [IP_Flow 19-1839] IP Catalog is up to date.
INFO: [DRC 23-27] Running DRC with 2 threads
INFO: [Vivado_Tcl 2-168] The results of DRC are in file C:/Repo-Asus-2026/VHDL-Basys3/Combinacionales/BinarioBCD_V1/BinarioBCD_V1.runs/impl_1/BIn_BCD1_drc_routed.rpt.
report_drc completed successfully
INFO: [runtcl-4] Executing : report_methodology -file BIn_BCD1_methodology_drc_routed.rpt -pb BIn_BCD1_methodology_drc_routed.pb -rpx BIn_BCD1_methodology_drc_routed.rpx
Command: report_methodology -file BIn_BCD1_methodology_drc_routed.rpt -pb BIn_BCD1_methodology_drc_routed.pb -rpx BIn_BCD1_methodology_drc_routed.rpx
INFO: [Timing 38-35] Done setting XDC timing constraints.
INFO: [DRC 23-133] Running Methodology with 2 threads
INFO: [Vivado_Tcl 2-1520] The results of Report Methodology are in file C:/Repo-Asus-2026/VHDL-Basys3/Combinacionales/BinarioBCD_V1/BinarioBCD_V1.runs/impl_1/BIn_BCD1_methodology_drc_routed.rpt.
report_methodology completed successfully
INFO: [runtcl-4] Executing : report_power -file BIn_BCD1_power_routed.rpt -pb BIn_BCD1_power_summary_routed.pb -rpx BIn_BCD1_power_routed.rpx
Command: report_power -file BIn_BCD1_power_routed.rpt -pb BIn_BCD1_power_summary_routed.pb -rpx BIn_BCD1_power_routed.rpx
INFO: [Timing 38-35] Done setting XDC timing constraints.
WARNING: [Power 33-232] No user defined clocks were found in the design! Power estimation will be inaccurate until this is corrected.
Resolution: Please specify clocks using create_clock/create_generated_clock for sequential elements. For pure combinatorial circuits, please specify a virtual clock, otherwise the vectorless estimation might be inaccurate
Running Vector-less Activity Propagation...

Finished Running Vector-less Activity Propagation
69 Infos, 2 Warnings, 0 Critical Warnings and 0 Errors encountered.
report_power completed successfully
INFO: [runtcl-4] Executing : report_route_status -file BIn_BCD1_route_status.rpt -pb BIn_BCD1_route_status.pb
INFO: [runtcl-4] Executing : report_timing_summary -max_paths 10 -report_unconstrained -file BIn_BCD1_timing_summary_routed.rpt -pb BIn_BCD1_timing_summary_routed.pb -rpx BIn_BCD1_timing_summary_routed.rpx -warn_on_violation 
INFO: [Timing 38-91] UpdateTimingParams: Speed grade: -1, Delay Type: min_max.
INFO: [Timing 38-191] Multithreading enabled for timing update using a maximum of 2 CPUs
WARNING: [Timing 38-313] There are no user specified timing constraints. Timing constraints are needed for proper timing analysis.
INFO: [runtcl-4] Executing : report_incremental_reuse -file BIn_BCD1_incremental_reuse_routed.rpt
INFO: [Vivado_Tcl 4-1062] Incremental flow is disabled. No incremental reuse Info to report.
INFO: [runtcl-4] Executing : report_clock_utilization -file BIn_BCD1_clock_utilization_routed.rpt
INFO: [runtcl-4] Executing : report_bus_skew -warn_on_violation -file BIn_BCD1_bus_skew_routed.rpt -pb BIn_BCD1_bus_skew_routed.pb -rpx BIn_BCD1_bus_skew_routed.rpx
INFO: [Timing 38-91] UpdateTimingParams: Speed grade: -1, Delay Type: min_max.
INFO: [Timing 38-191] Multithreading enabled for timing update using a maximum of 2 CPUs
INFO: [Timing 38-480] Writing timing data to binary archive.
Writing XDEF routing.
Writing XDEF routing logical nets.
Writing XDEF routing special nets.
Write XDEF Complete: Time (s): cpu = 00:00:01 ; elapsed = 00:00:00.070 . Memory (MB): peak = 2046.391 ; gain = 0.000
INFO: [Common 17-1381] The checkpoint 'C:/Repo-Asus-2026/VHDL-Basys3/Combinacionales/BinarioBCD_V1/BinarioBCD_V1.runs/impl_1/BIn_BCD1_routed.dcp' has been generated.
INFO: [Common 17-206] Exiting Vivado at Sat Jan 17 06:48:20 2026...

*** Running vivado
    with args -log BIn_BCD1.vdi -applog -m64 -product Vivado -messageDb vivado.pb -mode batch -source BIn_BCD1.tcl -notrace


ECHO est  desactivado.
ECHO est  desactivado.

****** Vivado v2023.1.1 (64-bit)
  **** SW Build 3900603 on Fri Jun 16 19:31:24 MDT 2023
  **** IP Build 3900379 on Sat Jun 17 05:28:05 MDT 2023
  **** SharedData Build 3899622 on Fri Jun 16 03:34:24 MDT 2023
    ** Copyright 1986-2022 Xilinx, Inc. All Rights Reserved.
    ** Copyright 2022-2023 Advanced Micro Devices, Inc. All Rights Reserved.

source BIn_BCD1.tcl -notrace
Command: open_checkpoint BIn_BCD1_routed.dcp
INFO: [Device 21-403] Loading part xc7a35tcpg236-1
Netlist sorting complete. Time (s): cpu = 00:00:00 ; elapsed = 00:00:00.001 . Memory (MB): peak = 888.859 ; gain = 0.000
INFO: [Project 1-479] Netlist was created with Vivado 2023.1.1
INFO: [Project 1-570] Preparing netlist for logic optimization
INFO: [Timing 38-478] Restoring timing data from binary archive.
INFO: [Timing 38-479] Binary timing data restore complete.
INFO: [Project 1-856] Restoring constraints from binary archive.
INFO: [Project 1-853] Binary constraint restore complete.
Reading XDEF placement.
Reading placer database...
Reading XDEF routing.
Read XDEF Files: Time (s): cpu = 00:00:00 ; elapsed = 00:00:00.125 . Memory (MB): peak = 1563.430 ; gain = 16.516
Restored from archive | CPU: 0.000000 secs | Memory: 0.000000 MB |
Finished XDEF File Restore: Time (s): cpu = 00:00:00 ; elapsed = 00:00:00.126 . Memory (MB): peak = 1563.430 ; gain = 16.516
Netlist sorting complete. Time (s): cpu = 00:00:00 ; elapsed = 00:00:00 . Memory (MB): peak = 1563.430 ; gain = 0.000
INFO: [Project 1-111] Unisim Transformation Summary:
No Unisim elements were transformed.

INFO: [Project 1-604] Checkpoint was created with Vivado v2023.1.1 (64-bit) build 3900603
open_checkpoint: Time (s): cpu = 00:00:27 ; elapsed = 00:00:30 . Memory (MB): peak = 1563.430 ; gain = 1277.789
Command: write_bitstream -force BIn_BCD1.bit
Attempting to get a license for feature 'Implementation' and/or device 'xc7a35t'
INFO: [Common 17-349] Got license for feature 'Implementation' and/or device 'xc7a35t'
Running DRC as a precondition to command write_bitstream
INFO: [IP_Flow 19-234] Refreshing IP repositories
INFO: [IP_Flow 19-1704] No user IP repositories specified
INFO: [IP_Flow 19-2313] Loaded Vivado IP repository 'C:/Xilinx/Vivado/2023.1/data/ip'.
INFO: [DRC 23-27] Running DRC with 2 threads
INFO: [Vivado 12-3199] DRC finished with 0 Errors
INFO: [Vivado 12-3200] Please refer to the DRC report (report_drc) for more information.
INFO: [Designutils 20-2272] Running write_bitstream with 2 threads.
Loading data files...
Loading site data...
Loading route data...
Processing options...
Creating bitmap...
Creating bitstream...
Writing bitstream ./BIn_BCD1.bit...
INFO: [Vivado 12-1842] Bitgen Completed Successfully.
INFO: [Project 1-1876] WebTalk data collection is mandatory when using a ULT device. To see the specific WebTalk data collected for your design, open the usage_statistics_webtalk.html or usage_statistics_webtalk.xml file in the implementation directory.
INFO: [Common 17-83] Releasing license: Implementation
20 Infos, 0 Warnings, 0 Critical Warnings and 0 Errors encountered.
write_bitstream completed successfully
write_bitstream: Time (s): cpu = 00:00:14 ; elapsed = 00:00:14 . Memory (MB): peak = 2114.613 ; gain = 551.184
INFO: [Common 17-206] Exiting Vivado at Sat Jan 17 06:49:55 2026...
